the lounge area is lovely and the desserts there are amazing	4	1
super location on top of pacific place	4	1
staff are very friendly though especially raj at the president 's club desk and the	3	0
we enjoyed the room and the hotel immensely	4	1
i was also <unk> by the high price of using wifi	5	0
large midtown hotel the hyatt is just steps from grand central terminal and convenient to	3	0
fast wifi ( free to 1g daily ) access to public transport	3	0
i expect more from an <unk> real downfall for this hotel is its restaurants	4	0
good value 140 exec room inc	4	1
although the views from the roof top bar restaurant were very good after dark	5	1
the accommodation is basic even though highly priced	2	1
also the hotel is set back from the street so even the outside rooms may	3	1
nice n helping staff and good breakfast spread on 18th floor	5	1
there 's nothing terrible about this place - but there are way too many better	4	1
but food is decently priced and great	5	1
i paid cash for the bus back to the airport not realising that a limo	5	0
the limited time we spent in the lounge was great and the service exceptional	4	1
spend a quick 2 days at this hotel and found it to be friendly staff	5	1
the service was good	4	1
i actually had some very nice pasta with a pesto sauce along with some draft	3	0
beach is beautiful with ample chairs	4	0
unpretentious hotel in a fantastic location	5	1
excellent service	2	0
we ate dinner one night in the hotel as it was raining very heavy	5	0
the toilet bowl had an unpleasant smell for the few days that we stayed	2	1
but the room was great	5	1
everyone from the cleaners to the go 's to the manager are very friendly and	4	1
the small pool area is adjacent sharing the terrific view	5	1
everything was very high standard and the buffet breakfast was fantastic	5	1
it might well be the fact that paris hotels are different but we did not	4	0
the rooms are quite small but really showing their age	3	1
any worries for later about noise did not occur as we had a great nights	5	1
good shopping and eating too are close at hand ( the pizza and hot chocolate	5	1
generally the best service is in south east asia	5	1
the same high price applied to all other items of clothing	3	1
excellent hotel , i will return !	5	1
but the selection close to the pool was fine - with the benefit of chiller	4	1
i went to the front desk	3	1
you will find their aluminum floored pool which ranges from <unk> to 5 feet in	5	0
for a budget hotel you could do much worse and if you are after a	4	1
highly recommend this amazing hotel	5	1
the reason i am hung up on grout is that last week i reviewed the	4	0
your average centrally located business hotel	3	1
bathroom was huge with a big tub and separate shower <unk> in all a great	5	1
most of my meetings were in the financial district in the <unk> area and the	4	0
i look forward to coming and staying again	5	1
it would of been expensive to eat meals here otherwise	5	0
yet intimate and like all high floors has a nice view of tokyo city	5	1
the walk was easy and so picturesque	5	1
the hotel staff are nice and attentative	5	1
in room dining served cold tea with breakfast - a remarkable service error given what	4	0
affordable parking	5	1
hilton deansgate is about 15 min walk from the city center main shopping area	4	1
good food choices for breakfast	3	0
front desk and concierge very polite	4	1
so we called and luckily got a room in this elegant and luxurious hotel	5	1
was in a good location for melbourne	3	0
not black tea )	2	1
good location but expensive	5	0
i ordered room service and the chicken soup was the worst i have ever had	1	1
to compensate that the beds are very comfortable with pretty good tv channels selection	4	1
nice <unk> between <unk> and <unk> area	5	1
swimming pool is nice but opening hours can be extended a little bit	4	0
perfect for early am flights	4	1
the hotel is fine - but a bit tired - could do with being modernised	3	1
house guests are provided with a free <unk> transport card for unlimited travel bus train	3	0
easy walk to anywhere	3	0
) i was a little disappointed and astonished by the person handling the taxis out	4	0
and proximity to the lifts made everything very convenient - went from parking to their	5	1
the lobby is very nice and i love the modern fireplace	5	1
it is a short walk to the funicular which will take you to the foot	5	1
high floor will give you the best views	5	1
we got a good nights sleep each night due to a comfortable bed and pillows	5	1
i stayed there one night as i had to take shinkansen next day	5	0
best hotel at mex airport	5	1
- tv reception was <unk> due to the ridiculously hard beds	2	1
the breakfast had a few different choices and was very good	4	1
the tables at the reception were peeling and needed urgent <unk> .	2	1
with probably the best shower of my trip	4	1
a room on the 2nd floor was opened for breakfast	3	1
decor of the main areas was decent	3	1
pool and common areas are lovely	4	1
hotel does offer free shuttle service to dubai mall	5	1
and that the floor in the shower is a little too smooth for my liking	4	1
the front desk staff responded immediately and within a few minutes they had someone on	5	1
room service vs <unk> shop closes at 3	3	1
being on the 2 floor i really felt in the middle of the party so	4	0
the lobby decor is interesting and many was snapping shots of the silver ball right	4	1
great airport hotel near in-n-out	5	1
clean and spacious	5	1
pool area is very nice	3	0
good independent air con and a good sized bathroom with a shower over a bath	4	1
anyway the rest of the stay was very good	4	1
the apartment very clean	4	1
the rooms were a nice size and the room included a large walk-in shower	5	1
the building is gorgeous and the room service food quite good	4	1
is it really too much to expect a major brand airport hotel	3	1
guam was interesting to visit for about a week	3	0
the internet access is only through cable ( it means no internet for cell phones	4	0
my fourth stay at this property over a 9 month period	5	1
perfectly situated for a short walk into the city the langham delivers in every way	5	1
the bed was a double	4	0
a very good business hotel located right across the street from a very <unk> mall	5	1
big bathroom with separate rain shower room with nice bathtub and a walk in closet	5	1
a nice sitting area and second closet	5	1
the new hotel restaurant that just opened is great but booked out that eve	5	0
and you can order special coffee from the bar	4	1
the spa service and treatment was very professional and relaxing	5	1
all the right touches and variety	5	1
it is still possible to open the window to get fresh air but those who	4	1
the hotel is well located with the daiba station only 1 minute away & surrounded	5	1
very nice bar to enjoy live music and drinks	5	1
excellent value for money	4	1
good restaurants nearby but the hotel restaurants are excellent and should be tried	5	1
yet it was still tricky to find parking near your villa	5	0
stayed on club floor with everything you could want	5	1
the lobby is similar to any four star hotel	4	1
our room was on the 3rd floor which was a large room with a door	4	1
however the double bed was uncomfortable and was <unk> exterior	2	1
again if small shower cubicle compared to some	4	0
so all facilities and modern and also with a nice style	5	1
the sitting area was nice when we all wanted to be in one room to	4	1
the location is great - a lush area of the city near connaught place and	4	1
check in desk is on the first floor and was very very busy but they	4	0
had a delicious dinner	3	0
the hotel staff were friendly but definitely a lot more commercial than the people we	3	1
we were too tired to venture out so we spent our time in the cafe	5	1
one thing which stood out about the lounge was the service - without exception the	4	1
very close to the airport	4	1
we stayed here for 7 nights and the service was impeccable throughout our stay	5	1
at times the pool felt like you were in the midst of a kindergarten outing	3	1
the hotel is located in tokyo midtown	4	1
a nice hotel in a city with a few	4	1
rooms were good and spacious but again there can be more work put into them	3	1
despite its unprepossessing location the hotel is surprisingly convenient for tourist spots like covent garden	5	1
modern and located right on the beach with great views of doha from pretty much	5	1
if the food is such good quality and the chefs amazing	3	0
extensive public areas and a bit of warmth in the guest rooms	4	1
okay hotel with an outstanding restaurant	3	0
bathroom also spacious and in good condition	4	1
the receptionist was very helpful and did assist me with changing some money into hong	4	1
walking distance to old town about 3-5 minutes	5	1
this is the perfect business hotel in a non touristy city	4	1
moment you enter to warm smiles you are dwarfed by the huge number of people	4	1
the next day i had a light lunch in the cafe which was also very	5	1
large rooms	4	1
the executive lounge facility was excellent and it is in a good location	4	1
it 's about a 3 minutes walk to the boqueria and there are a lot	4	1
we had an early flight so thought we would stay at the sofitel as it	5	0
the breakfast buffet was very good and the staff is very polite and friendly	3	0
the hotel is conveniently located near the beach and many interesting shops and eateries	5	1
the only small criticism was the very small and crowded breakfast room ( but	4	1
this hotel is very nice and its restaurants seem to be a hot spot for	4	1
it has a good range of facilities	4	1
well on my second trip to istanbul 16 years later	5	0
and this is reflected in the poor quality of fittings and furniture in the hotel	3	0
the room was larger	4	1
room facing the temple temple view room we had 2 rooms facing the temples with	5	1
the toilet was like a <unk> ( really horrible )	3	0
and i 've seen a lot better showers in lower category hotels	4	0
pay high prices ( us retail ) and read for your entire stay	3	0
they took the time to send a nice note but did not put any towels	2	1
- lobby is large and tasteless	3	1
got before check-in time and they couldnt find the reservation	2	1
as well as tables and chairs in a covered area to eat or read	4	1
had to ask front desk every day	2	1
linens and towels new and nice	5	1
service needs improving but it is all good value if you are very busy in	4	1
i did have a massage and the spa is very nice	4	1
when i chose this hotel on the internet i was uncertain what to expect but	5	0
i 've stayed here at the luxor on more than one vacation	4	1
missing the personal touch	3	1
the location was great - the hotel is in south yarra - the area is	4	1
the room was excellent and faced onto the garden areas	5	1
from the general manager to the concierge	5	0
the bar pool areas were very nice and drink prices seemed reasonable	3	0
the lodge is situated close to the entrance to the national park and equally close	4	1
but heating vents directly over the equipment is a bit much- room decor in the	4	0
correct but pricy wifi extremely expensive	3	0
-a small but fully equipped gym	5	1
the grounds are good for a walk and nicely kept	4	1
we could have stayed at the more affordable ibis next door but this place is	4	0
my room was on the 17th floor and on the quiet part of hotel	4	1
the excellent staff providing top class service is wonderful	5	1
the staff was exceptional in asking us if we needed anything	5	1
except for snacks and the prices are comparable to hotel prices	4	0
close to the worlds best hotel shower	5	1
except for an unfortunate experience with their victoria bar where we walked out due to	4	0
if staying close to the town centre is your <unk>	4	1
you can pay for this ticket either from the drivers directly ( mostly stopping infront	5	0
this hotel is fabulous	5	1
snorkeling right off the beach was good with a lot to see	4	1
clean and the lounge is very decent to have an evening brunch	5	1
children play area and kids pool just outside the spa	4	1
nice pool	4	1
the separate toilet is a <unk> opening push button affair ( there are two toilets	4	0
its only a 10 min drive down to the centre of palma and about a	5	1
stayed here for 3 nights and the most impressive thing about this hotel is that	4	1
the food at the restaurant was less than i expected for an hotel of this	3	1
free shuttle bus service ( book your seats in advance at the hotel conceirge )	4	1
